{
  "schemaVersion": 1,
  "id": "kaykit_containers_a",
  "displayName": "containers A",
  "category": "environment",
  "version": "v01",
  "revision": 1,
  "source": {
    "path": "blender/environment/kaykit_containers_a/v01/kaykit_containers_a_v01.blend",
    "mode": "manual",
    "importedFrom": "assets/third_party/kaykit/space_base_bits/1.0.0/addons/kaykit_space_base_bits/Assets/gltf/containers_A.gltf",
    "authoritativeHash": "b00448e3a0fd28a13c3f78b0c10d12238ee8bd20aa2f01c1539c65caf089f4cd"
  },
  "runtime": "assets/runtime/environment/kaykit_containers_a_v01.glb",
  "budgets": {
    "triangles": 800,
    "materials": 1,
    "textures": 1,
    "textureSize": 1024,
    "bones": 0,
    "meshes": 1
  },
  "contract": {
    "root": "root",
    "up": "+Y",
    "forward": "+Z",
    "metres": true,
    "grounded": true,
    "groundTolerance": 0.002,
    "rootMotion": false,
    "anchors": []
  },
  "clips": [],
  "references": [
    {
      "path": "assets/third_party/kaykit/space_base_bits/1.0.0/addons/kaykit_space_base_bits/Assets/gltf/containers_A.gltf",
      "provenance": "KayKit / Kay Lousberg, Space Base Bits 1.0, CC0; unmodified upstream source."
    },
    {
      "path": "assets/third_party/kaykit/space_base_bits/1.0.0/addons/kaykit_space_base_bits/Assets/LICENSE.txt",
      "provenance": "Upstream CC0 license retained byte-for-byte."
    }
  ],
  "overrides": [
    {
      "field": "budgets.textureSize",
      "value": 1024,
      "reason": "Retain the existing shared upstream 1024 px palette atlas during storage-only migration; no texture resampling or new unique texture introduced."
    }
  ],
  "milestones": [],
  "decisions": "blender/environment/kaykit_containers_a/v01/decisions.md",
  "delivery": {
    "sha256": "2dcb0995e0612d42b5186cc60b01db12ddf09d14d47d11489f6d649316c2f832",
    "sourceHash": "b00448e3a0fd28a13c3f78b0c10d12238ee8bd20aa2f01c1539c65caf089f4cd",
    "report": "blender/environment/kaykit_containers_a/v01/validation/report.json",
    "deliveredAt": "2026-09-12T13:34:24.572Z"
  }
}
