{
  "schemaVersion": 1,
  "id": "kaykit_tunnel_diagonal_short_b",
  "displayName": "tunnel diagonal short B",
  "category": "environment",
  "version": "v01",
  "revision": 1,
  "source": {
    "path": "blender/environment/kaykit_tunnel_diagonal_short_b/v01/kaykit_tunnel_diagonal_short_b_v01.blend",
    "mode": "manual",
    "importedFrom": "assets/third_party/kaykit/space_base_bits/1.0.0/addons/kaykit_space_base_bits/Assets/gltf/tunnel_diagonal_short_B.gltf",
    "authoritativeHash": "8c3b848a3de894ce441e3b26827d9b38a6c55d31f652b35cd2c0f4bbdcc9f462"
  },
  "runtime": "assets/runtime/environment/kaykit_tunnel_diagonal_short_b_v01.glb",
  "budgets": {
    "triangles": 800,
    "materials": 1,
    "textures": 1,
    "textureSize": 1024,
    "bones": 0,
    "meshes": 1
  },
  "contract": {
    "root": "root",
    "up": "+Y",
    "forward": "+Z",
    "metres": true,
    "grounded": false,
    "groundTolerance": 0.002,
    "rootMotion": false,
    "anchors": [],
    "groundY": 0.20000000298023224
  },
  "clips": [],
  "references": [
    {
      "path": "assets/third_party/kaykit/space_base_bits/1.0.0/addons/kaykit_space_base_bits/Assets/gltf/tunnel_diagonal_short_B.gltf",
      "provenance": "KayKit / Kay Lousberg, Space Base Bits 1.0, CC0; unmodified upstream source."
    },
    {
      "path": "assets/third_party/kaykit/space_base_bits/1.0.0/addons/kaykit_space_base_bits/Assets/LICENSE.txt",
      "provenance": "Upstream CC0 license retained byte-for-byte."
    }
  ],
  "overrides": [
    {
      "field": "contract.grounded",
      "reason": "Preserve the imported assembly/terrain origin during storage migration; not a zero-grounded actor. Authored contact level is recorded in groundY."
    },
    {
      "field": "budgets.textureSize",
      "value": 1024,
      "reason": "Retain the existing shared upstream 1024 px palette atlas during storage-only migration; no texture resampling or new unique texture introduced."
    }
  ],
  "milestones": [],
  "decisions": "blender/environment/kaykit_tunnel_diagonal_short_b/v01/decisions.md",
  "delivery": {
    "sha256": "14c938ee7a6b664a79406ec398d5f732f24ccf255f9b615c839445ff9538e80d",
    "sourceHash": "8c3b848a3de894ce441e3b26827d9b38a6c55d31f652b35cd2c0f4bbdcc9f462",
    "report": "blender/environment/kaykit_tunnel_diagonal_short_b/v01/validation/report.json",
    "deliveredAt": "2026-09-12T13:34:24.604Z"
  }
}
