{
  "schemaVersion": 1,
  "id": "kaykit_lander_a",
  "displayName": "lander A",
  "category": "environment",
  "version": "v01",
  "revision": 1,
  "source": {
    "path": "blender/environment/kaykit_lander_a/v01/kaykit_lander_a_v01.blend",
    "mode": "manual",
    "importedFrom": "assets/third_party/kaykit/space_base_bits/1.0.0/addons/kaykit_space_base_bits/Assets/gltf/lander_A.gltf",
    "authoritativeHash": "825a1b91e95996db189c4f08e22a16d9736c3b5ffd4d221d897bf981194df04a"
  },
  "runtime": "assets/runtime/environment/kaykit_lander_a_v01.glb",
  "budgets": {
    "triangles": 1500,
    "materials": 1,
    "textures": 1,
    "textureSize": 1024,
    "bones": 0,
    "meshes": 1
  },
  "contract": {
    "root": "root",
    "up": "+Y",
    "forward": "+Z",
    "metres": true,
    "grounded": true,
    "groundTolerance": 0.002,
    "rootMotion": false,
    "anchors": []
  },
  "clips": [],
  "references": [
    {
      "path": "assets/third_party/kaykit/space_base_bits/1.0.0/addons/kaykit_space_base_bits/Assets/gltf/lander_A.gltf",
      "provenance": "KayKit / Kay Lousberg, Space Base Bits 1.0, CC0; unmodified upstream source."
    },
    {
      "path": "assets/third_party/kaykit/space_base_bits/1.0.0/addons/kaykit_space_base_bits/Assets/LICENSE.txt",
      "provenance": "Upstream CC0 license retained byte-for-byte."
    }
  ],
  "overrides": [
    {
      "field": "budgets.textureSize",
      "value": 1024,
      "reason": "Retain the existing shared upstream 1024 px palette atlas during storage-only migration; no texture resampling or new unique texture introduced."
    }
  ],
  "milestones": [],
  "decisions": "blender/environment/kaykit_lander_a/v01/decisions.md",
  "delivery": {
    "sha256": "0958aa6d02f48bce9ddce3cfc62eeb12f2c3b25ab6d63d44caa0cf1b25a2a63a",
    "sourceHash": "825a1b91e95996db189c4f08e22a16d9736c3b5ffd4d221d897bf981194df04a",
    "report": "blender/environment/kaykit_lander_a/v01/validation/report.json",
    "deliveredAt": "2026-09-12T13:34:24.577Z"
  }
}
