{
  "schemaVersion": 1,
  "id": "kaykit_windturbine_tall",
  "displayName": "windturbine tall",
  "category": "environment",
  "version": "v01",
  "revision": 1,
  "source": {
    "path": "blender/environment/kaykit_windturbine_tall/v01/kaykit_windturbine_tall_v01.blend",
    "mode": "manual",
    "importedFrom": "assets/third_party/kaykit/space_base_bits/1.0.0/addons/kaykit_space_base_bits/Assets/gltf/windturbine_tall.gltf",
    "authoritativeHash": "4dfb2488d1f96780d35ea57de59aabaec2716ffb5f5159fd1a80b46c6a0dee0e"
  },
  "runtime": "assets/runtime/environment/kaykit_windturbine_tall_v01.glb",
  "budgets": {
    "triangles": 800,
    "materials": 1,
    "textures": 1,
    "textureSize": 1024,
    "bones": 0,
    "meshes": 2
  },
  "contract": {
    "root": "root",
    "up": "+Y",
    "forward": "+Z",
    "metres": true,
    "grounded": true,
    "groundTolerance": 0.002,
    "rootMotion": false,
    "anchors": []
  },
  "clips": [],
  "references": [
    {
      "path": "assets/third_party/kaykit/space_base_bits/1.0.0/addons/kaykit_space_base_bits/Assets/gltf/windturbine_tall.gltf",
      "provenance": "KayKit / Kay Lousberg, Space Base Bits 1.0, CC0; unmodified upstream source."
    },
    {
      "path": "assets/third_party/kaykit/space_base_bits/1.0.0/addons/kaykit_space_base_bits/Assets/LICENSE.txt",
      "provenance": "Upstream CC0 license retained byte-for-byte."
    }
  ],
  "overrides": [
    {
      "field": "budgets.textureSize",
      "value": 1024,
      "reason": "Retain the existing shared upstream 1024 px palette atlas during storage-only migration; no texture resampling or new unique texture introduced."
    }
  ],
  "milestones": [],
  "decisions": "blender/environment/kaykit_windturbine_tall/v01/decisions.md",
  "delivery": {
    "sha256": "c46a8558218494dfdbbdfebc5c9ac5f3c8db9ec2c2a752117ce74df46bd87f48",
    "sourceHash": "4dfb2488d1f96780d35ea57de59aabaec2716ffb5f5159fd1a80b46c6a0dee0e",
    "report": "blender/environment/kaykit_windturbine_tall/v01/validation/report.json",
    "deliveredAt": "2026-09-12T13:34:24.607Z"
  }
}
