{
  "schemaVersion": 1,
  "id": "campus_tree_round",
  "displayName": "Campus tree · round crown",
  "category": "environment",
  "version": "v01",
  "revision": 2,
  "source": {
    "path": "blender/environment/campus_tree_round/v01/campus_tree_round_v01.blend",
    "mode": "procedural",
    "recipe": "blender/environment/campus_tree_round/v01/build.py"
  },
  "runtime": "assets/runtime/environment/campus_tree_round_v01.glb",
  "budgets": {
    "triangles": 800,
    "materials": 1,
    "textures": 0,
    "textureSize": 512,
    "bones": 0,
    "meshes": 1
  },
  "contract": {
    "root": "root",
    "up": "+Y",
    "forward": "+Z",
    "metres": true,
    "grounded": true,
    "groundTolerance": 0.002,
    "rootMotion": false,
    "anchors": [
      "anchor_ui"
    ]
  },
  "clips": [],
  "references": [
    {
      "path": "prototypes/hub/previews/before-3d-study.png",
      "provenance": "Project-owned Glacier SVG campus, including floating panel, inset paths and faceted landscaping."
    },
    {
      "path": "tools/asset-recipes/campus-kit.py",
      "provenance": "Shared geometry helper used by the local versioned recipe."
    }
  ],
  "overrides": [],
  "milestones": [],
  "decisions": "blender/environment/campus_tree_round/v01/decisions.md"
}
