{
  "schemaVersion": 1,
  "id": "kaykit_roofmodule_cargo_b",
  "displayName": "roofmodule cargo B",
  "category": "environment",
  "version": "v01",
  "revision": 1,
  "source": {
    "path": "blender/environment/kaykit_roofmodule_cargo_b/v01/kaykit_roofmodule_cargo_b_v01.blend",
    "mode": "manual",
    "importedFrom": "assets/third_party/kaykit/space_base_bits/1.0.0/addons/kaykit_space_base_bits/Assets/gltf/roofmodule_cargo_B.gltf",
    "authoritativeHash": "fb1dfe6b9e167509e682b73df42a5f25fbf7ab2096e82208569a3f139f6d847a"
  },
  "runtime": "assets/runtime/environment/kaykit_roofmodule_cargo_b_v01.glb",
  "budgets": {
    "triangles": 800,
    "materials": 1,
    "textures": 1,
    "textureSize": 1024,
    "bones": 0,
    "meshes": 1
  },
  "contract": {
    "root": "root",
    "up": "+Y",
    "forward": "+Z",
    "metres": true,
    "grounded": false,
    "groundTolerance": 0.002,
    "rootMotion": false,
    "anchors": [],
    "groundY": -0.10000007599592209
  },
  "clips": [],
  "references": [
    {
      "path": "assets/third_party/kaykit/space_base_bits/1.0.0/addons/kaykit_space_base_bits/Assets/gltf/roofmodule_cargo_B.gltf",
      "provenance": "KayKit / Kay Lousberg, Space Base Bits 1.0, CC0; unmodified upstream source."
    },
    {
      "path": "assets/third_party/kaykit/space_base_bits/1.0.0/addons/kaykit_space_base_bits/Assets/LICENSE.txt",
      "provenance": "Upstream CC0 license retained byte-for-byte."
    }
  ],
  "overrides": [
    {
      "field": "contract.grounded",
      "reason": "Preserve the imported assembly/terrain origin during storage migration; not a zero-grounded actor. Authored contact level is recorded in groundY."
    },
    {
      "field": "budgets.textureSize",
      "value": 1024,
      "reason": "Retain the existing shared upstream 1024 px palette atlas during storage-only migration; no texture resampling or new unique texture introduced."
    }
  ],
  "milestones": [],
  "decisions": "blender/environment/kaykit_roofmodule_cargo_b/v01/decisions.md",
  "delivery": {
    "sha256": "ba1f362cccd6c90f61f8db07cdd6a204b03ab5861512120d89bce32efc9468d1",
    "sourceHash": "fb1dfe6b9e167509e682b73df42a5f25fbf7ab2096e82208569a3f139f6d847a",
    "report": "blender/environment/kaykit_roofmodule_cargo_b/v01/validation/report.json",
    "deliveredAt": "2026-09-12T13:34:24.587Z"
  }
}
