{
  "schemaVersion": 1,
  "id": "campus_walk_corner",
  "displayName": "Campus walkway · square corner",
  "category": "environment",
  "version": "v01",
  "revision": 2,
  "source": {
    "path": "blender/environment/campus_walk_corner/v01/campus_walk_corner_v01.blend",
    "mode": "procedural",
    "recipe": "blender/environment/campus_walk_corner/v01/build.py",
    "authoritativeHash": "2a872a198f3602146843106f2076fe754353a9e46d5069594cf458dea86cfcff"
  },
  "runtime": "assets/runtime/environment/campus_walk_corner_v01.glb",
  "budgets": {
    "triangles": 1200,
    "materials": 1,
    "textures": 0,
    "textureSize": 512,
    "bones": 0,
    "meshes": 1
  },
  "contract": {
    "root": "root",
    "up": "+Y",
    "forward": "+Z",
    "metres": true,
    "grounded": true,
    "groundTolerance": 0.002,
    "rootMotion": false,
    "anchors": [
      "anchor_start",
      "anchor_end"
    ]
  },
  "clips": [],
  "references": [
    {
      "path": "prototypes/hub/previews/before-3d-study.png",
      "provenance": "Project-owned Glacier SVG campus, including floating panel, inset paths and faceted landscaping."
    },
    {
      "path": "tools/asset-recipes/campus-kit.py",
      "provenance": "Shared geometry helper used by the local versioned recipe."
    }
  ],
  "overrides": [],
  "milestones": [],
  "decisions": "blender/environment/campus_walk_corner/v01/decisions.md",
  "delivery": {
    "sha256": "af2493467d7a908ed9d24d88823abe451d46b57e274cfb98ab7ca65427ae9357",
    "sourceHash": "2a872a198f3602146843106f2076fe754353a9e46d5069594cf458dea86cfcff",
    "report": "blender/environment/campus_walk_corner/v01/validation/report.json",
    "deliveredAt": "2026-09-17T20:39:16.373Z"
  }
}
