{
  "schemaVersion": 1,
  "id": "kaykit_landingpad_small",
  "displayName": "landingpad small",
  "category": "environment",
  "version": "v01",
  "revision": 1,
  "source": {
    "path": "blender/environment/kaykit_landingpad_small/v01/kaykit_landingpad_small_v01.blend",
    "mode": "manual",
    "importedFrom": "assets/third_party/kaykit/space_base_bits/1.0.0/addons/kaykit_space_base_bits/Assets/gltf/landingpad_small.gltf",
    "authoritativeHash": "2c085179ca21eb5dc3e6fae1bd19e0b9f6b6f490bc53e0cb3664fed087dd4384"
  },
  "runtime": "assets/runtime/environment/kaykit_landingpad_small_v01.glb",
  "budgets": {
    "triangles": 800,
    "materials": 1,
    "textures": 1,
    "textureSize": 1024,
    "bones": 0,
    "meshes": 1
  },
  "contract": {
    "root": "root",
    "up": "+Y",
    "forward": "+Z",
    "metres": true,
    "grounded": true,
    "groundTolerance": 0.002,
    "rootMotion": false,
    "anchors": []
  },
  "clips": [],
  "references": [
    {
      "path": "assets/third_party/kaykit/space_base_bits/1.0.0/addons/kaykit_space_base_bits/Assets/gltf/landingpad_small.gltf",
      "provenance": "KayKit / Kay Lousberg, Space Base Bits 1.0, CC0; unmodified upstream source."
    },
    {
      "path": "assets/third_party/kaykit/space_base_bits/1.0.0/addons/kaykit_space_base_bits/Assets/LICENSE.txt",
      "provenance": "Upstream CC0 license retained byte-for-byte."
    }
  ],
  "overrides": [
    {
      "field": "budgets.textureSize",
      "value": 1024,
      "reason": "Retain the existing shared upstream 1024 px palette atlas during storage-only migration; no texture resampling or new unique texture introduced."
    }
  ],
  "milestones": [],
  "decisions": "blender/environment/kaykit_landingpad_small/v01/decisions.md",
  "delivery": {
    "sha256": "13182795de2b4763b9494a41dfe5d9295374e43fe87c58106d251c79db118166",
    "sourceHash": "2c085179ca21eb5dc3e6fae1bd19e0b9f6b6f490bc53e0cb3664fed087dd4384",
    "report": "blender/environment/kaykit_landingpad_small/v01/validation/report.json",
    "deliveredAt": "2026-09-12T13:34:24.580Z"
  }
}
